"location","source","target","id","fuzzy","context","translator_comments","developer_comments"
"SCRIPTS/CONTENT/gothic.d:41423","Onar wynaj¹³ ich, by bronili jego farmy.","Onar wynaj¹³ ich, by bronili jego farmy.","","","dia_bau_7_join_07_01","",""
"SCRIPTS/CONTENT/gothic.d:41424","Wiêkszoœæ z nich zachowuje siê tak, jakby farma by³a ich w³asnoœci¹. Ale to prawda, ¿e nas ochraniaj¹.","Wiêkszoœæ z nich zachowuje siê tak, jakby farma by³a ich w³asnoœci¹. Ale to prawda, ¿e nas ochraniaj¹.","","","dia_bau_7_join_07_02","",""
"SCRIPTS/CONTENT/gothic.d:41432","Kto tu dowodzi?","Kto tu dowodzi?","","","dia_bau_7_people.description","",""
"SCRIPTS/CONTENT/gothic.d:41440","Kto tu rz¹dzi?","Kto tu rz¹dzi?","","","dia_bau_7_people_15_00","",""
"SCRIPTS/CONTENT/gothic.d:41441","Du¿a farma nale¿y do Onara. Mniejsze tak¿e, ale te wynajmuje okolicznym mieszkañcom.","Du¿a farma nale¿y do Onara. Mniejsze tak¿e, ale te wynajmuje okolicznym mieszkañcom.","","","dia_bau_7_people_07_01","",""
"SCRIPTS/CONTENT/gothic.d:41449","Powiedz mi coœ na temat okolicy.","Powiedz mi coœ na temat okolicy.","","","dia_bau_7_location.description","",""
"SCRIPTS/CONTENT/gothic.d:41457","Powiedz mi coœ na temat okolicy.","Powiedz mi coœ na temat okolicy.","","","dia_bau_7_location_15_00","",""
"SCRIPTS/CONTENT/gothic.d:41458","Du¿a farma po wschodniej stronie doliny nale¿y do Onara. Na pó³noc st¹d le¿y farma Sekoba.","Du¿a farma po wschodniej stronie doliny nale¿y do Onara. Na pó³noc st¹d le¿y farma Sekoba.","","","dia_bau_7_location_07_01","",""
"SCRIPTS/CONTENT/gothic.d:41459","Jest jeszcze farma Bengara, która le¿y na wzniesieniu, na po³udniowy zachód st¹d. Mo¿esz siê tam przedostaæ z doliny - musisz jedynie wejœæ po kamiennych schodach.","Jest jeszcze farma Bengara, która le¿y na wzniesieniu, na po³udniowy zachód st¹d. Mo¿esz siê tam przedostaæ z doliny - musisz jedynie wejœæ po kamiennych schodach.","","","dia_bau_7_location_07_02","",""
"SCRIPTS/CONTENT/gothic.d:41467","Co nowego?","Co nowego?","","","dia_bau_7_standard.description","",""
"SCRIPTS/CONTENT/gothic.d:41475","Co s³ychaæ?","Co s³ychaæ?","","","dia_bau_7_standard_15_00","",""
"SCRIPTS/CONTENT/gothic.d:41477","Og³osiliœmy niepodleg³oœæ - nie p³acimy ju¿ podatków na rzecz miasta. Król nic nigdy dla nas nie zrobi³ - mieliœmy tego doœæ!","Og³osiliœmy niepodleg³oœæ - nie p³acimy ju¿ podatków na rzecz miasta. Król nic nigdy dla nas nie zrobi³ - mieliœmy tego doœæ!","","","dia_bau_7_standard_07_01","",""
"SCRIPTS/CONTENT/gothic.d:41480","W tej chwili niewiele siê tu dzieje.","W tej chwili niewiele siê tu dzieje.","","","dia_bau_7_standard_07_02","",""
"SCRIPTS/CONTENT/gothic.d:41483","Ostatnio ludzie zaczêli opowiadaæ coœ o smokach. A król robi wszystko, ¿eby tylko wycisn¹æ z poddanych jak najwiêcej pieniêdzy.","Ostatnio ludzie zaczêli opowiadaæ coœ o smokach. A król robi wszystko, ¿eby tylko wycisn¹æ z poddanych jak najwiêcej pieniêdzy.","","","dia_bau_7_standard_07_03","",""
"SCRIPTS/CONTENT/gothic.d:41486","Uwa¿aj na siebie, wzd³u¿ prze³êczy pa³êta siê wiele podejrzanych typków i dzikich bestii.","Uwa¿aj na siebie, wzd³u¿ prze³êczy pa³êta siê wiele podejrzanych typków i dzikich bestii.","","","dia_bau_7_standard_07_04","",""
"SCRIPTS/CONTENT/gothic.d:41489","Teraz, po œmierci smoków, paladyni zechcieli ³askawie opuœciæ mury miasta. Czas najwy¿szy, by na ulicach znów zapanowa³ porz¹dek.","Teraz, po œmierci smoków, paladyni zechcieli ³askawie opuœciæ mury miasta. Czas najwy¿szy, by na ulicach znów zapanowa³ porz¹dek.","","","dia_bau_7_standard_07_05","",""
"SCRIPTS/CONTENT/gothic.d:41536","ZejdŸ mi z oczu!","ZejdŸ mi z oczu!","","","dia_bdt_1_standard_01_00","",""
"SCRIPTS/CONTENT/gothic.d:41539","Szukasz k³opotów?","Szukasz k³opotów?","","","dia_bdt_1_standard_01_01","",""
"SCRIPTS/CONTENT/gothic.d:41542","OdejdŸ, póki mo¿esz!","OdejdŸ, póki mo¿esz!","","","dia_bdt_1_standard_01_02","",""
"SCRIPTS/CONTENT/gothic.d:41583","Wynocha!","Wynocha!","","","dia_bdt_13_standard_13_01","",""
"SCRIPTS/CONTENT/gothic.d:41591","Na co siê gapisz, kretynie!","Na co siê gapisz, kretynie!","","","dia_bdt_13_standard_13_00","",""
"SCRIPTS/CONTENT/gothic.d:41597","Zostaw mnie w spokoju, przyb³êdo.","Zostaw mnie w spokoju, przyb³êdo.","","","dia_bdt_13_standard_13_02","",""
"SCRIPTS/CONTENT/gothic.d:41628","Co powinienem zrobiæ, aby wst¹piæ do stra¿y?","Co powinienem zrobiæ, aby wst¹piæ do stra¿y?","","","dia_mil_6_join.description","",""
"SCRIPTS/CONTENT/gothic.d:41638","Co powinienem zrobiæ, ¿eby siê zaci¹gn¹æ do stra¿y?","Co powinienem zrobiæ, ¿eby siê zaci¹gn¹æ do stra¿y?","","","dia_mil_6_join_15_00","",""
"SCRIPTS/CONTENT/gothic.d:41639","Porozmawiaj z Lordem Andre. Od kiedy paladyni przybyli do miasta, to w³aœnie on nadzoruje dzia³ania stra¿y.","Porozmawiaj z Lordem Andre. Od kiedy paladyni przybyli do miasta, to w³aœnie on nadzoruje dzia³ania stra¿y.","","","dia_mil_6_join_06_01","",""
"SCRIPTS/CONTENT/gothic.d:41641","Znajdziesz go w koszarach. Praktycznie z nich nie wychodzi.","Znajdziesz go w koszarach. Praktycznie z nich nie wychodzi.","","","dia_mil_6_join_06_02","",""
"SCRIPTS/CONTENT/gothic.d:41650","S³ysza³em, ¿e zniknêli jacyœ ludzie.","S³ysza³em, ¿e zniknêli jacyœ ludzie.","","","dia_addon_mil_6_missingpeople.description","",""
"SCRIPTS/CONTENT/gothic.d:41660","S³ysza³em, ¿e zniknêli jacyœ ludzie.","S³ysza³em, ¿e zniknêli jacyœ ludzie.","","","dia_addon_mil_6_missingpeople_15_00","",""
"SCRIPTS/CONTENT/gothic.d:41661","Rzeczywiœcie - ostatnio czêsto mamy doniesienia o zaginiêciach.","Rzeczywiœcie - ostatnio czêsto mamy doniesienia o zaginiêciach.","","","dia_addon_mil_6_missingpeople_06_01","",""
"SCRIPTS/CONTENT/gothic.d:41662","Nie potrafiê tego wyjaœniæ, choæ bym chcia³.","Nie potrafiê tego wyjaœniæ, choæ bym chcia³.","","","dia_addon_mil_6_missingpeople_06_02","",""
"SCRIPTS/CONTENT/gothic.d:41663","Mo¿emy tylko mieæ oczy i uszy szeroko otwarte.","Mo¿emy tylko mieæ oczy i uszy szeroko otwarte.","","","dia_addon_mil_6_missingpeople_06_03","",""
"SCRIPTS/CONTENT/gothic.d:41671","Opowiedz mi o tych paladynach.","Opowiedz mi o tych paladynach.","","","dia_mil_6_people.description","",""
"SCRIPTS/CONTENT/gothic.d:41681","Opowiedz mi o tych paladynach.","Opowiedz mi o tych paladynach.","","","dia_mil_6_people_15_00","",""
"SCRIPTS/CONTENT/gothic.d:41682","Zaraz po przybyciu do Khorinis udali siê do górnego miasta.","Zaraz po przybyciu do Khorinis udali siê do górnego miasta.","","","dia_mil_6_people_06_01","",""
"SCRIPTS/CONTENT/gothic.d:41683","Od tego czasu nikt poza obywatelami miasta, i oczywiœcie stra¿¹, nie ma tam wstêpu.","Od tego czasu nikt poza obywatelami miasta, i oczywiœcie stra¿¹, nie ma tam wstêpu.","","","dia_mil_6_people_06_02","",""
"SCRIPTS/CONTENT/gothic.d:41684","Kilku paladynów stacjonuje przy statku, w porcie. Ale nie nale¿¹ do specjalnie rozmownych.","Kilku paladynów stacjonuje przy statku, w porcie. Ale nie nale¿¹ do specjalnie rozmownych.","","","dia_mil_6_people_06_03","",""
"SCRIPTS/CONTENT/gothic.d:41692","Co powinienem wiedzieæ o tym mieœcie?","Co powinienem wiedzieæ o tym mieœcie?","","","dia_mil_6_location.description","",""
"SCRIPTS/CONTENT/gothic.d:41700","Co powinienem wiedzieæ o tym mieœcie?","Co powinienem wiedzieæ o tym mieœcie?","","","dia_mil_6_location_15_00","",""
"SCRIPTS/CONTENT/gothic.d:41701","Kontrolê nad miastem przejêli paladyni. Stra¿ bezpoœrednio im podlega.","Kontrolê nad miastem przejêli paladyni. Stra¿ bezpoœrednio im podlega.","","","dia_mil_6_location_06_01","",""
"SCRIPTS/CONTENT/gothic.d:41702","Lord Andre, dowódca stra¿y, pe³ni tak¿e funkcjê sêdziego.","Lord Andre, dowódca stra¿y, pe³ni tak¿e funkcjê sêdziego.","","","dia_mil_6_location_06_02","",""
"SCRIPTS/CONTENT/gothic.d:41703","Jeœli zdarzy ci siê z³amaæ prawo, bêdziesz siê musia³ przed nim wyt³umaczyæ.","Jeœli zdarzy ci siê z³amaæ prawo, bêdziesz siê musia³ przed nim wyt³umaczyæ.","","","dia_mil_6_location_06_03","",""
"SCRIPTS/CONTENT/gothic.d:41704","Jednak nie martw siê, jest cz³owiekiem ugodowym. Przewa¿nie nak³ada jedynie grzywnê.","Jednak nie martw siê, jest cz³owiekiem ugodowym. Przewa¿nie nak³ada jedynie grzywnê.","","","dia_mil_6_location_06_04","",""
"SCRIPTS/CONTENT/gothic.d:41712","Co nowego?","Co nowego?","","","dia_mil_6_standard.description","",""
"SCRIPTS/CONTENT/gothic.d:41720","Co s³ychaæ?","Co s³ychaæ?","","","dia_mil_6_standard_15_00","",""
"SCRIPTS/CONTENT/gothic.d:41722","W mieœcie coraz wiêcej szumowin.","W mieœcie coraz wiêcej szumowin.","","","dia_mil_6_standard_06_01","",""
"SCRIPTS/CONTENT/gothic.d:41723","Wszêdzie coraz wiêcej z³odziei. Lord Andre podejrzewa nawet, ¿e ca³e to zamieszanie jest sprawk¹ gangu.","Wszêdzie coraz wiêcej z³odziei. Lord Andre podejrzewa nawet, ¿e ca³e to zamieszanie jest sprawk¹ gangu.","","","dia_mil_6_standard_06_02","",""
"SCRIPTS/CONTENT/gothic.d:41724","Niedawno przetrz¹snêliœmy dok³adnie ca³¹ dzielnicê portow¹, ale niczego nie znaleŸliœmy.","Niedawno przetrz¹snêliœmy dok³adnie ca³¹ dzielnicê portow¹, ale niczego nie znaleŸliœmy.","","","dia_mil_6_standard_06_03","",""
"SCRIPTS/CONTENT/gothic.d:41727","Wygl¹da na to, ¿e problem bandytów mamy ju¿ z g³owy. Ataki sta³y siê ostatnimi czasy rzadkoœci¹.","Wygl¹da na to, ¿e problem bandytów mamy ju¿ z g³owy. Ataki sta³y siê ostatnimi czasy rzadkoœci¹.","","","dia_mil_6_standard_06_04","",""
"SCRIPTS/CONTENT/gothic.d:41730","Z dnia na dzieñ jest coraz gorzej, wszystko przez te szumowiny wrêcz zalewaj¹ce miasto. Ostatniej nocy œledzi³em pewnego typka w czarnych szatach, zd¹¿aj¹cego ku górnemu miastu.","Z dnia na dzieñ jest coraz gorzej, wszystko przez te szumowiny wrêcz zalewaj¹ce miasto. Ostatniej nocy œledzi³em pewnego typka w czarnych szatach, zd¹¿aj¹cego ku górnemu miastu.","","","dia_mil_6_standard_06_05","",""
"SCRIPTS/CONTENT/gothic.d:41731","Od pocz¹tku wyda³ mi siê podejrzany. Œledzi³em go a¿ pod dom gubernatora. Tam znikn¹³. Mówiê ci, dziwna to by³a postaæ.","Od pocz¹tku wyda³ mi siê podejrzany. Œledzi³em go a¿ pod dom gubernatora. Tam znikn¹³. Mówiê ci, dziwna to by³a postaæ.","","","dia_mil_6_standard_06_06","",""
"SCRIPTS/CONTENT/gothic.d:41734","S³ysza³em, ¿e Lord Hagen zatrudni³ najemników, by zajêli siê smokami. Mnie to odpowiada, nie chcia³bym sam zmierzyæ siê z tymi bestiami.","S³ysza³em, ¿e Lord Hagen zatrudni³ najemników, by zajêli siê smokami. Mnie to odpowiada, nie chcia³bym sam zmierzyæ siê z tymi bestiami.","","","dia_mil_6_standard_06_07","",""
"SCRIPTS/CONTENT/gothic.d:41737","Mówi siê, ¿e smoki zosta³y pokonane. Ponoæ Lord Hagen zbiera si³y, by ostatecznie wygnaæ je tak¿e z Górniczej Doliny.","Mówi siê, ¿e smoki zosta³y pokonane. Ponoæ Lord Hagen zbiera si³y, by ostatecznie wygnaæ je tak¿e z Górniczej Doliny.","","","dia_mil_6_standard_06_08","",""
"SCRIPTS/CONTENT/gothic.d:41770","Chcê wst¹piæ do stra¿y.","Chcê wst¹piæ do stra¿y.","","","dia_mil_7_join.description","",""
"SCRIPTS/CONTENT/gothic.d:41780","Chcê wst¹piæ do stra¿y.","Chcê wst¹piæ do stra¿y.","","","dia_mil_7_join_15_00","",""
"SCRIPTS/CONTENT/gothic.d:41782","Nie jesteœ nawet obywatelem Khorinis! Dlaczego myœlisz, ¿e Lord Andre zechce ciê przyj¹æ?","Nie jesteœ nawet obywatelem Khorinis! Dlaczego myœlisz, ¿e Lord Andre zechce ciê przyj¹æ?","","","dia_mil_7_join_07_01","",""
"SCRIPTS/CONTENT/gothic.d:41783","Gdyby tak by³o, ka¿dy móg³by sobie przyjœæ, wzi¹æ przydzia³ow¹ broñ i zbrojê, a póŸniej znikn¹æ na dobre!","Gdyby tak by³o, ka¿dy móg³by sobie przyjœæ, wzi¹æ przydzia³ow¹ broñ i zbrojê, a póŸniej znikn¹æ na dobre!","","","dia_mil_7_join_07_02","",""
"SCRIPTS/CONTENT/gothic.d:41785","Ja mówiê powa¿nie!","Ja mówiê powa¿nie!","","","dia_mil_7_join_15_03","",""
"SCRIPTS/CONTENT/gothic.d:41786","Nie wyjaœniaj tego mnie, tylko Lordowi Andre. Znajdziesz go w koszarach.","Nie wyjaœniaj tego mnie, tylko Lordowi Andre. Znajdziesz go w koszarach.","","","dia_mil_7_join_07_04","",""
"SCRIPTS/CONTENT/gothic.d:41799","Co wiesz o paladynach?","Co wiesz o paladynach?","","","dia_mil_7_people.description","",""
"SCRIPTS/CONTENT/gothic.d:41809","Co wiesz o paladynach?","Co wiesz o paladynach?","","","dia_mil_7_people_15_00","",""
"SCRIPTS/CONTENT/gothic.d:41810","Niewiele. Nikt w³aœciwie nie wie, dlaczego tu przybyli. Nawet ci z nas, którzy s³u¿¹ w stra¿y.","Niewiele. Nikt w³aœciwie nie wie, dlaczego tu przybyli. Nawet ci z nas, którzy s³u¿¹ w stra¿y.","","","dia_mil_7_people_07_01","",""
"SCRIPTS/CONTENT/gothic.d:41811","Przejêli kontrolê nad miastem, przegonili gubernatora z jego komnat, zwolnili te¿ sêdziego z urzêdu.","Przejêli kontrolê nad miastem, przegonili gubernatora z jego komnat, zwolnili te¿ sêdziego z urzêdu.","","","dia_mil_7_people_07_02","",""
"SCRIPTS/CONTENT/gothic.d:41812","Jeœli chcesz znaæ moje zdanie, to dobrze siê sta³o. Tym nadêtym os³om przyda siê lekcja pokory.","Jeœli chcesz znaæ moje zdanie, to dobrze siê sta³o. Tym nadêtym os³om przyda siê lekcja pokory.","","","dia_mil_7_people_07_03","",""
"SCRIPTS/CONTENT/gothic.d:41820","Jakie perspektywy daje to miasto?","Jakie perspektywy daje to miasto?","","","dia_mil_7_location.description","",""
"SCRIPTS/CONTENT/gothic.d:41828","Jakie perspektywy daje to miasto?","Jakie perspektywy daje to miasto?","","","dia_mil_7_location_15_00","",""
"SCRIPTS/CONTENT/gothic.d:41829","Jeœli nie chcesz skoñczyæ w rynsztoku dzielnicy portowej, znajdŸ sobie jak¹œ sta³¹ pracê. Popytaj w dolnej czêœci miasta, mo¿e tam uda ci siê coœ znaleŸæ.","Jeœli nie chcesz skoñczyæ w rynsztoku dzielnicy portowej, znajdŸ sobie jak¹œ sta³¹ pracê. Popytaj w dolnej czêœci miasta, mo¿e tam uda ci siê coœ znaleŸæ.","","","dia_mil_7_location_07_01","",""
"SCRIPTS/CONTENT/gothic.d:41830","Jeœli chcesz d³u¿ej pozostaæ w mieœcie, powinieneœ przy³¹czyæ siê do stra¿y lub chocia¿ podszkoliæ siê w walce.","Jeœli chcesz d³u¿ej pozostaæ w mieœcie, powinieneœ przy³¹czyæ siê do stra¿y lub chocia¿ podszkoliæ siê w walce.","","","dia_mil_7_location_07_02","",""
"SCRIPTS/CONTENT/gothic.d:41831","Instruktorzy w koszarach szkol¹ tak¿e cywili.","Instruktorzy w koszarach szkol¹ tak¿e cywili.","","","dia_mil_7_location_07_03","",""
"SCRIPTS/CONTENT/gothic.d:41832","Wkrótce pojawi¹ siê tu orkowie, a wtedy docenisz wojskowy trening i godziny na nim spêdzone.","Wkrótce pojawi¹ siê tu orkowie, a wtedy docenisz wojskowy trening i godziny na nim spêdzone.","","","dia_mil_7_location_07_04","",""
"SCRIPTS/CONTENT/gothic.d:41840","Co nowego?","Co nowego?","","","dia_mil_7_standard.description","",""
"SCRIPTS/CONTENT/gothic.d:41850","Co s³ychaæ?","Co s³ychaæ?","","","dia_mil_7_standard_15_00","",""
"SCRIPTS/CONTENT/gothic.d:41854","Ludzie znikaj¹ jeden po drugim. Nie uda³o nam siê jeszcze dowiedzieæ, co siê z nimi dzieje.","Ludzie znikaj¹ jeden po drugim. Nie uda³o nam siê jeszcze dowiedzieæ, co siê z nimi dzieje.","","","dia_addon_mil_7_standard_07_00","",""
"SCRIPTS/CONTENT/gothic.d:41863","Ponoæ ch³opi siê buntuj¹. Nie doœæ, ¿e jesteœmy w œrodku wojny z orkami, to jeszcze musimy siê u¿eraæ z tymi prostakami.","Ponoæ ch³opi siê buntuj¹. Nie doœæ, ¿e jesteœmy w œrodku wojny z orkami, to jeszcze musimy siê u¿eraæ z tymi prostakami.","","","dia_mil_7_standard_07_01","",""
"SCRIPTS/CONTENT/gothic.d:41867","Czas ju¿, by paladyni zajêli siê rebeli¹ ch³opów. Kto ³amie prawo, powinien ponieœæ tego surowe konsekwencje. Szczególnie teraz, kiedy toczy siê wojna.","Czas ju¿, by paladyni zajêli siê rebeli¹ ch³opów. Kto ³amie prawo, powinien ponieœæ tego surowe konsekwencje. Szczególnie teraz, kiedy toczy siê wojna.","","","dia_mil_7_standard_07_02","",""
"SCRIPTS/CONTENT/gothic.d:41871","Najemnik, którego oskar¿ono o zabójstwo Lothara, jest prawdopodobnie niewinny. Ponoæ ktoœ znalaz³ dowód na to, ¿e go wrobiono.","Najemnik, którego oskar¿ono o zabójstwo Lothara, jest prawdopodobnie niewinny. Ponoæ ktoœ znalaz³ dowód na to, ¿e go wrobiono.","","","dia_mil_7_standard_07_03","",""
"SCRIPTS/CONTENT/gothic.d:41874","Jeden z najemników Onara zamordowa³ Lothara, czcigodnego paladyna. Na szczêœcie drañ zosta³ z³apany i wtr¹cony do wiêzienia.","Jeden z najemników Onara zamordowa³ Lothara, czcigodnego paladyna. Na szczêœcie drañ zosta³ z³apany i wtr¹cony do wiêzienia.","","","dia_mil_7_standard_07_04","",""
"SCRIPTS/CONTENT/gothic.d:41878","Niektórzy z najemników opuœcili farmê Onara. Jak widaæ, problem rozwi¹zuje siê sam.","Niektórzy z najemników opuœcili farmê Onara. Jak widaæ, problem rozwi¹zuje siê sam.","","","dia_mil_7_standard_07_05","",""
"SCRIPTS/CONTENT/gothic.d:41881","Pozbyliœmy siê smoków, ale to nie koniec. Nastêpni w kolejce s¹ orkowie. Nied³ugo wszystkim siê zajmiemy!","Pozbyliœmy siê smoków, ale to nie koniec. Nastêpni w kolejce s¹ orkowie. Nied³ugo wszystkim siê zajmiemy!","","","dia_mil_7_standard_07_06","",""
"SCRIPTS/CONTENT/gothic.d:41914","Potrzebujê pomocy w sprz¹taniu sal nowicjuszy.","Potrzebujê pomocy w sprz¹taniu sal nowicjuszy.","","","dia_nov_3_fegen.description","",""
"SCRIPTS/CONTENT/gothic.d:41928","Potrzebujê pomocy w sprz¹taniu sal nowicjuszy.","Potrzebujê pomocy w sprz¹taniu sal nowicjuszy.","","","dia_nov_3_fegen_15_00","",""
"SCRIPTS/CONTENT/gothic.d:41931","Czy¿by nikt nie zgodzi³ ci siê pomóc? Dobrze... Bêdê ci towarzyszy³ przy tym zajêciu, jeœli znajdziesz jeszcze przynajmniej jedn¹ osobê, która zgodzi siê na to samo.","Czy¿by nikt nie zgodzi³ ci siê pomóc? Dobrze... Bêdê ci towarzyszy³ przy tym zajêciu, jeœli znajdziesz jeszcze przynajmniej jedn¹ osobê, która zgodzi siê na to samo.","","","dia_nov_3_fegen_03_01","",""
"SCRIPTS/CONTENT/gothic.d:41935","Czy bêdê jedyn¹ osob¹ pomagaj¹c¹ ci w pracy?","Czy bêdê jedyn¹ osob¹ pomagaj¹c¹ ci w pracy?","","","dia_nov_3_fegen_03_02","",""
"SCRIPTS/CONTENT/gothic.d:41936","Nie, ju¿ ktoœ mi pomaga.","Nie, ju¿ ktoœ mi pomaga.","","","dia_nov_3_fegen_15_03","",""
"SCRIPTS/CONTENT/gothic.d:41937","A wiêc i ja do was do³¹czê.","A wiêc i ja do was do³¹czê.","","","dia_nov_3_fegen_03_04","",""
"SCRIPTS/CONTENT/gothic.d:41947","Bracie! Ju¿ przecie¿ ci pomagam, nie musisz mnie dalej nak³aniaæ.","Bracie! Ju¿ przecie¿ ci pomagam, nie musisz mnie dalej nak³aniaæ.","","","dia_nov_3_fegen_03_05","",""
"SCRIPTS/CONTENT/gothic.d:41953","Oczywiœcie, ¿e ci pomogê. My nowicjusze powinniœmy trzymaæ siê razem. Rêka rêkê myje, jeœli wiesz co mam na myœli.","Oczywiœcie, ¿e ci pomogê. My nowicjusze powinniœmy trzymaæ siê razem. Rêka rêkê myje, jeœli wiesz co mam na myœli.","","","dia_nov_3_fegen_03_08","",""
"SCRIPTS/CONTENT/gothic.d:41954","Potrzebujê jednak 50 sztuk z³ota, w koñcu muszê sp³aciæ Parlana.","Potrzebujê jednak 50 sztuk z³ota, w koñcu muszê sp³aciæ Parlana.","","","dia_nov_3_fegen_03_09","",""
"SCRIPTS/CONTENT/gothic.d:41957","Mo¿e póŸniej...","Mo¿e póŸniej...","","","dia_nov_3_fegen.dia_nov_3_fegen_nein","Info_AddChoice",""
"SCRIPTS/CONTENT/gothic.d:41959","W porz¹dku, ju¿ p³acê.","W porz¹dku, ju¿ p³acê.","","","dia_nov_3_fegen.dia_nov_3_fegen_ja","Info_AddChoice",""
"SCRIPTS/CONTENT/gothic.d:41963","Przecie¿ obieca³em. Ty pomog³eœ mnie, ja pomogê tobie.","Przecie¿ obieca³em. Ty pomog³eœ mnie, ja pomogê tobie.","","","dia_nov_3_fegen_03_06","",""
"SCRIPTS/CONTENT/gothic.d:41967","Wykluczone - nie mam na to czasu. Poszukaj sobie kogoœ innego do pomocy.","Wykluczone - nie mam na to czasu. Poszukaj sobie kogoœ innego do pomocy.","","","dia_nov_3_fegen_03_07","",""
"SCRIPTS/CONTENT/gothic.d:41972","Mo¿e innym razem, teraz nie staæ mnie na taki wydatek.","Mo¿e innym razem, teraz nie staæ mnie na taki wydatek.","","","dia_nov_3_fegen_nein_15_00","",""
"SCRIPTS/CONTENT/gothic.d:41977","W porz¹dku, ju¿ p³acê.","W porz¹dku, ju¿ p³acê.","","","dia_nov_3_fegen_ja_15_00","",""
"SCRIPTS/CONTENT/gothic.d:41978","Biorê siê wiêc do pracy.","Biorê siê wiêc do pracy.","","","dia_nov_3_fegen_ja_03_01","",""
"SCRIPTS/CONTENT/gothic.d:41994","Chcesz spróbowaæ kie³basy?","Chcesz spróbowaæ kie³basy?","","","dia_nov_3_wurst.description","",""
"SCRIPTS/CONTENT/gothic.d:42007","Mo¿e chcesz kie³basê?","Mo¿e chcesz kie³basê?","","","dia_nov_3_wurst_15_00","",""
"SCRIPTS/CONTENT/gothic.d:42008","Jasne, czemu nie. Wygl¹da smakowicie.","Jasne, czemu nie. Wygl¹da smakowicie.","","","dia_nov_3_wurst_03_01","",""
"SCRIPTS/CONTENT/gothic.d:42023","Chcia³bym zostaæ magiem.","Chcia³bym zostaæ magiem.","","","dia_nov_3_join.description","",""
"SCRIPTS/CONTENT/gothic.d:42033","Chcia³bym zostaæ magiem.","Chcia³bym zostaæ magiem.","","","dia_nov_3_join_15_00","",""
"SCRIPTS/CONTENT/gothic.d:42034","Wiêkszoœæ nowicjuszy tego pragnie, jednak niewielu z nich udaje siê zyskaæ tytu³ Wybrañca, i szansê przyjêcia do Krêgu Ognia.","Wiêkszoœæ nowicjuszy tego pragnie, jednak niewielu z nich udaje siê zyskaæ tytu³ Wybrañca, i szansê przyjêcia do Krêgu Ognia.","","","dia_nov_3_join_03_01","",""
"SCRIPTS/CONTENT/gothic.d:42035","Najwy¿szym zaszczytem, jakiego mo¿esz dost¹piæ w naszym zakonie, jest tytu³ maga Krêgu Ognia.","Najwy¿szym zaszczytem, jakiego mo¿esz dost¹piæ w naszym zakonie, jest tytu³ maga Krêgu Ognia.","","","dia_nov_3_join_03_02","",""
"SCRIPTS/CONTENT/gothic.d:42036","Bêdziesz musia³ ciê¿ko pracowaæ, by zas³u¿yæ na swoj¹ szansê.","Bêdziesz musia³ ciê¿ko pracowaæ, by zas³u¿yæ na swoj¹ szansê.","","","dia_nov_3_join_03_03","",""
"SCRIPTS/CONTENT/gothic.d:42044","Kto jest przywódc¹ klasztoru?","Kto jest przywódc¹ klasztoru?","","","dia_nov_3_people.description","",""
"SCRIPTS/CONTENT/gothic.d:42052","Kto jest przywódc¹ klasztoru?","Kto jest przywódc¹ klasztoru?","","","dia_nov_3_people_15_00","",""
"SCRIPTS/CONTENT/gothic.d:42053","My, nowicjusze, s³u¿ymy magom Krêgu Ognia. Oni zaœ podlegaj¹ decyzjom Najwy¿szej Rady, w sk³ad której wchodz¹ trzej najpotê¿niejsi magowie.","My, nowicjusze, s³u¿ymy magom Krêgu Ognia. Oni zaœ podlegaj¹ decyzjom Najwy¿szej Rady, w sk³ad której wchodz¹ trzej najpotê¿niejsi magowie.","","","dia_nov_3_people_03_01","",""
"SCRIPTS/CONTENT/gothic.d:42054","Sprawami nowicjuszy zajmuje siê jednak Parlan. Prawie zawsze przesiaduje na dziedziñcu, nadzoruj¹c ich pracê.","Sprawami nowicjuszy zajmuje siê jednak Parlan. Prawie zawsze przesiaduje na dziedziñcu, nadzoruj¹c ich pracê.","","","dia_nov_3_people_03_02","",""
"SCRIPTS/CONTENT/gothic.d:42062","Co mo¿esz mi powiedzieæ o tym klasztorze?","Co mo¿esz mi powiedzieæ o tym klasztorze?","","","dia_nov_3_location.description","",""
"SCRIPTS/CONTENT/gothic.d:42070","Co mo¿esz mi powiedzieæ o tym klasztorze?","Co mo¿esz mi powiedzieæ o tym klasztorze?","","","dia_nov_3_location_15_00","",""
"SCRIPTS/CONTENT/gothic.d:42071","¯yjemy tu bardzo skromnie. Hodujemy owce i wytwarzamy wino.","¯yjemy tu bardzo skromnie. Hodujemy owce i wytwarzamy wino.","","","dia_nov_3_location_03_01","",""
"SCRIPTS/CONTENT/gothic.d:42072","Mamy te¿ bibliotekê, ale dostêp do niej posiadaj¹ jedynie magowie i wybrani nowicjusze.","Mamy te¿ bibliotekê, ale dostêp do niej posiadaj¹ jedynie magowie i wybrani nowicjusze.","","","dia_nov_3_location_03_02","",""
"SCRIPTS/CONTENT/gothic.d:42073","My, nowicjusze, dbamy o to, by niczego nie zabrak³o magom Krêgu Ognia.","My, nowicjusze, dbamy o to, by niczego nie zabrak³o magom Krêgu Ognia.","","","dia_nov_3_location_03_03","",""
"SCRIPTS/CONTENT/gothic.d:42081","Co nowego?","Co nowego?","","","dia_nov_3_standard.description","",""
"SCRIPTS/CONTENT/gothic.d:42089","Co s³ychaæ?","Co s³ychaæ?","","","dia_nov_3_standard_15_00","",""
"SCRIPTS/CONTENT/gothic.d:42092","Dobre pytanie! Nowicjusze rozmawiaj¹ tylko o tobie.","Dobre pytanie! Nowicjusze rozmawiaj¹ tylko o tobie.","","","dia_nov_3_standard_03_01","",""
"SCRIPTS/CONTENT/gothic.d:42093","Naprawdê rzadko siê zdarza, aby ktoœ obcy zosta³ tak szybko przyjêty do Krêgu Ognia.","Naprawdê rzadko siê zdarza, aby ktoœ obcy zosta³ tak szybko przyjêty do Krêgu Ognia.","","","dia_nov_3_standard_03_02","",""
"SCRIPTS/CONTENT/gothic.d:42096","Nadszed³ czas. Wkrótce któryœ z nowicjuszy zostanie przyjêty do Krêgu Ognia.","Nadszed³ czas. Wkrótce któryœ z nowicjuszy zostanie przyjêty do Krêgu Ognia.","","","dia_nov_3_standard_03_03","",""
"SCRIPTS/CONTENT/gothic.d:42097","Wkrótce rozpoczn¹ siê próby.","Wkrótce rozpoczn¹ siê próby.","","","dia_nov_3_standard_03_04","",""
"SCRIPTS/CONTENT/gothic.d:42102","Beliar zdo³a³ przenikn¹æ do naszego klasztoru! Jego potêga roœnie, skoro nawet tutaj ma ju¿ swoich sojuszników...","Beliar zdo³a³ przenikn¹æ do naszego klasztoru! Jego potêga roœnie, skoro nawet tutaj ma ju¿ swoich sojuszników...","","","dia_nov_3_standard_03_05","",""
"SCRIPTS/CONTENT/gothic.d:42103","Pedro s³u¿y³ w zakonie przez lata. Obawiam siê jednak, ¿e spêdzi³ poza tymi murami zbyt wiele czasu, to zaœ os³abi³o jego wiarê i uczyni³o podatnym na wp³ywy Beliara.","Pedro s³u¿y³ w zakonie przez lata. Obawiam siê jednak, ¿e spêdzi³ poza tymi murami zbyt wiele czasu, to zaœ os³abi³o jego wiarê i uczyni³o podatnym na wp³ywy Beliara.","","","dia_nov_3_standard_03_06","",""
